Media Source,Tweet,Date,Compound,Positive,Neutral,Negative,Tweets Ago
ABC News,"Manuel Oliver, grieving father of Parkland shooting victim Joaquin Oliver, paints a mural to pay tribute to his son… https://t.co/oIzPNE3lL0",Mon Mar 12 20:08:18 +0000 2018,-0.7003,0.0,0.702,0.298,1
ABC News,"RT @ABCNewsWX: Another day, another nor'easter. The 3rd one in less than two weeks! Boston to get clobbered on Tuesday with blizzard condit…",Mon Mar 12 20:04:37 +0000 2018,0.0,0.0,1.0,0.0,2
ABC News,"MORE: Authorities do not have descriptions of suspects, vehicles involved in series of explosions in Austin, implor… https://t.co/TmUfgSsERq",Mon Mar 12 20:02:00 +0000 2018,-0.34,0.0,0.876,0.124,3
ABC News,"Austin police chief encourages residents to be vigilant amid series of package explosions, alert authorities to une… https://t.co/2isieJWRRU",Mon Mar 12 19:54:44 +0000 2018,0.7003,0.312,0.688,0.0,4
ABC News,"NEW: Officials believe three explosions in past ten days in Austin, Texas are related; no motive identified yet.… https://t.co/NLzGujQjV7",Mon Mar 12 19:52:26 +0000 2018,-0.296,0.0,0.891,0.109,5
ABC News,"Joint Security Area a likely option for U.S.-North Korea talks, Seoul says. https://t.co/7rePZ6zJ4T https://t.co/fXtVrrrtDM",Mon Mar 12 19:51:06 +0000 2018,0.34,0.167,0.833,0.0,6
ABC News,"Scary video shows a professional skier being buried in an avalanche in the French Alps. Luckily, his quick-thinking… https://t.co/RjTb1Rr2Y1",Mon Mar 12 19:50:02 +0000 2018,0.0258,0.147,0.711,0.142,7
ABC News,"LIVE: Austin, Texas officials brief on package explosions that have killed at least one person today. https://t.co/ViKyGtbVyW",Mon Mar 12 19:48:33 +0000 2018,-0.6705,0.0,0.78,0.22,8
ABC News,Stunning video shows golfers hitting the links at the Lofoten Links course in Arctic Norway underneath the spectacu… https://t.co/IJVi7MMMfJ,Mon Mar 12 19:44:33 +0000 2018,0.3818,0.126,0.874,0.0,9
ABC News,"MORE: Texas Gov. Abbott offers $15,000 reward for information on any persons involved in explosions that have struc… https://t.co/D4LE0zp0HQ",Mon Mar 12 19:41:40 +0000 2018,0.5719,0.171,0.829,0.0,10
ABC News,RT @ABCPolitics: LIVE NOW: @rickklein and the @ABCPolitics team breaks down the White House briefing and the day in politics: https://t.co/…,Mon Mar 12 19:31:00 +0000 2018,0.0,0.0,1.0,0.0,11
ABC News,"NEW: Press Sec. Sanders calls nerve agent attack in UK an ""outrage,"" says ""we stand by our closest ally.""

Prime Mi… https://t.co/yluirOfItw",Mon Mar 12 19:28:47 +0000 2018,-0.4767,0.0,0.871,0.129,12
ABC News,"Press Sec. Sanders: ""Let's not forget that the Obama administration had the White House and all of Congress for two… https://t.co/nQr8MN0hEM",Mon Mar 12 19:22:25 +0000 2018,0.1695,0.077,0.923,0.0,13
ABC News,"RT @ABCPolitics: .@PressSec tells @jonkarl that many of the gun safety proposals previously mentioned by Pres. Trump, including raising age…",Mon Mar 12 19:21:48 +0000 2018,0.1027,0.121,0.776,0.103,14
ABC News,Big buck contributions come from surprising source in Texas politics. https://t.co/G1j7c6eh4W https://t.co/Nbg24eXle3,Mon Mar 12 19:17:03 +0000 2018,0.2732,0.16,0.84,0.0,15
ABC News,"Asked whether any of Pres. Trump's school safety proposals were opposed by the NRA, @PressSec tells @jonkarl, ""What… https://t.co/4wP9QYzA1t",Mon Mar 12 19:14:58 +0000 2018,0.4215,0.135,0.865,0.0,16
ABC News,"NEW: Pres. Trump to travel to Peru and Colombia, his first trip to Latin America. https://t.co/NkJuIoh4fP https://t.co/HWGBc9oyqK",Mon Mar 12 19:09:44 +0000 2018,0.0,0.0,1.0,0.0,17
ABC News,"Theresa May gives Russia until tomorrow to respond to nerve agent attack: ""Should there be no credible response, we… https://t.co/SykUpaOvLW",Mon Mar 12 19:09:36 +0000 2018,-0.6486,0.0,0.773,0.227,18
ABC News,LIVE: Press Sec. Sanders holds White House briefing. https://t.co/ASFmSifiyS,Mon Mar 12 19:08:11 +0000 2018,0.0,0.0,1.0,0.0,19
ABC News,"Always listen to your parents: Son ignores his dad’s pleading for him to slow down on his snowboard, crashes direct… https://t.co/ed5MeSDIGy",Mon Mar 12 18:56:55 +0000 2018,-0.2732,0.0,0.905,0.095,20
ABC News,"Manuel Oliver, grieving father of Parkland shooting victim Joaquin Oliver, paints a mural to pay tribute to his son… https://t.co/oIzPNE3lL0",Mon Mar 12 20:08:18 +0000 2018,-0.7003,0.0,0.702,0.298,21
ABC News,"RT @ABCNewsWX: Another day, another nor'easter. The 3rd one in less than two weeks! Boston to get clobbered on Tuesday with blizzard condit…",Mon Mar 12 20:04:37 +0000 2018,0.0,0.0,1.0,0.0,22
ABC News,"MORE: Authorities do not have descriptions of suspects, vehicles involved in series of explosions in Austin, implor… https://t.co/TmUfgSsERq",Mon Mar 12 20:02:00 +0000 2018,-0.34,0.0,0.876,0.124,23
ABC News,"Austin police chief encourages residents to be vigilant amid series of package explosions, alert authorities to une… https://t.co/2isieJWRRU",Mon Mar 12 19:54:44 +0000 2018,0.7003,0.312,0.688,0.0,24
ABC News,"NEW: Officials believe three explosions in past ten days in Austin, Texas are related; no motive identified yet.… https://t.co/NLzGujQjV7",Mon Mar 12 19:52:26 +0000 2018,-0.296,0.0,0.891,0.109,25
ABC News,"Joint Security Area a likely option for U.S.-North Korea talks, Seoul says. https://t.co/7rePZ6zJ4T https://t.co/fXtVrrrtDM",Mon Mar 12 19:51:06 +0000 2018,0.34,0.167,0.833,0.0,26
ABC News,"Scary video shows a professional skier being buried in an avalanche in the French Alps. Luckily, his quick-thinking… https://t.co/RjTb1Rr2Y1",Mon Mar 12 19:50:02 +0000 2018,0.0258,0.147,0.711,0.142,27
ABC News,"LIVE: Austin, Texas officials brief on package explosions that have killed at least one person today. https://t.co/ViKyGtbVyW",Mon Mar 12 19:48:33 +0000 2018,-0.6705,0.0,0.78,0.22,28
ABC News,Stunning video shows golfers hitting the links at the Lofoten Links course in Arctic Norway underneath the spectacu… https://t.co/IJVi7MMMfJ,Mon Mar 12 19:44:33 +0000 2018,0.3818,0.126,0.874,0.0,29
ABC News,"MORE: Texas Gov. Abbott offers $15,000 reward for information on any persons involved in explosions that have struc… https://t.co/D4LE0zp0HQ",Mon Mar 12 19:41:40 +0000 2018,0.5719,0.171,0.829,0.0,30
ABC News,RT @ABCPolitics: LIVE NOW: @rickklein and the @ABCPolitics team breaks down the White House briefing and the day in politics: https://t.co/…,Mon Mar 12 19:31:00 +0000 2018,0.0,0.0,1.0,0.0,31
ABC News,"NEW: Press Sec. Sanders calls nerve agent attack in UK an ""outrage,"" says ""we stand by our closest ally.""

Prime Mi… https://t.co/yluirOfItw",Mon Mar 12 19:28:47 +0000 2018,-0.4767,0.0,0.871,0.129,32
ABC News,"Press Sec. Sanders: ""Let's not forget that the Obama administration had the White House and all of Congress for two… https://t.co/nQr8MN0hEM",Mon Mar 12 19:22:25 +0000 2018,0.1695,0.077,0.923,0.0,33
ABC News,"RT @ABCPolitics: .@PressSec tells @jonkarl that many of the gun safety proposals previously mentioned by Pres. Trump, including raising age…",Mon Mar 12 19:21:48 +0000 2018,0.1027,0.121,0.776,0.103,34
ABC News,Big buck contributions come from surprising source in Texas politics. https://t.co/G1j7c6eh4W https://t.co/Nbg24eXle3,Mon Mar 12 19:17:03 +0000 2018,0.2732,0.16,0.84,0.0,35
ABC News,"Asked whether any of Pres. Trump's school safety proposals were opposed by the NRA, @PressSec tells @jonkarl, ""What… https://t.co/4wP9QYzA1t",Mon Mar 12 19:14:58 +0000 2018,0.4215,0.135,0.865,0.0,36
ABC News,"NEW: Pres. Trump to travel to Peru and Colombia, his first trip to Latin America. https://t.co/NkJuIoh4fP https://t.co/HWGBc9oyqK",Mon Mar 12 19:09:44 +0000 2018,0.0,0.0,1.0,0.0,37
ABC News,"Theresa May gives Russia until tomorrow to respond to nerve agent attack: ""Should there be no credible response, we… https://t.co/SykUpaOvLW",Mon Mar 12 19:09:36 +0000 2018,-0.6486,0.0,0.773,0.227,38
ABC News,LIVE: Press Sec. Sanders holds White House briefing. https://t.co/ASFmSifiyS,Mon Mar 12 19:08:11 +0000 2018,0.0,0.0,1.0,0.0,39
ABC News,"Always listen to your parents: Son ignores his dad’s pleading for him to slow down on his snowboard, crashes direct… https://t.co/ed5MeSDIGy",Mon Mar 12 18:56:55 +0000 2018,-0.2732,0.0,0.905,0.095,40
ABC News,"Meghan Markle attends her first official event with Queen Elizabeth, joining the royal family at a service marking… https://t.co/unsdkoZ6qd",Mon Mar 12 18:37:42 +0000 2018,0.0,0.0,1.0,0.0,41
ABC News,"Theresa May tells Parliament it is ""highly likely"" Russia was responsible for poisoning Russian ex-spy and his daug… https://t.co/IcZXhrnVbe",Mon Mar 12 18:11:16 +0000 2018,-0.3612,0.1,0.736,0.165,42
ABC News,Crews recover the helicopter from last night’s deadly crash in New York City’s East River; all five passengers aboa… https://t.co/QEB4UvQZu3,Mon Mar 12 18:06:25 +0000 2018,-0.4019,0.0,0.876,0.124,43
ABC News,"""A deliberate cover-up""?: U.S. Figure Skating reckoning with sexual abuse allegations against Olympic coach.… https://t.co/CK7gIEDSsD",Mon Mar 12 17:58:54 +0000 2018,-0.6369,0.0,0.769,0.231,44
ABC News,MORE: Austin police warn residents against opening unexpected packages following two explosions today.… https://t.co/lRrcqNijF6,Mon Mar 12 17:55:27 +0000 2018,-0.3233,0.0,0.848,0.152,45
ABC News,"LATEST: A second explosion has rocked Austin, Texas, hours after an earlier blast killed a teen and injured a woman. https://t.co/79KILI8TTj",Mon Mar 12 17:39:40 +0000 2018,-0.802,0.0,0.69,0.31,46
ABC News,"Dublin crowd chants ""Get well, Tim!"" after Faith Hill announces Tim McGraw would not return to the stage due to deh… https://t.co/TsT0k8Sven",Mon Mar 12 17:36:52 +0000 2018,0.636,0.206,0.794,0.0,47
ABC News,"RT @ABCPolitics: Theresa May: ""We will not tolerate such a brazen attempt to murder innocent civilians on our soil."" https://t.co/ASC7vmJBX…",Mon Mar 12 17:35:45 +0000 2018,-0.5106,0.1,0.705,0.195,48
ABC News,"May says she will give Russia until end of tomorrow to respond to nerve agent attack against ex-Russian spy. ""Shoul… https://t.co/saACwXFEjh",Mon Mar 12 17:33:56 +0000 2018,-0.4767,0.0,0.866,0.134,49
ABC News,"No power is no problem for this improvised group of singers, who harmonized in the darkened street following a powe… https://t.co/K2F7MKomcT",Mon Mar 12 17:33:45 +0000 2018,-0.5423,0.101,0.623,0.276,50
ABC News,"May: ""Either this was a direct act by the Russian state against our country, or the Russian government lost control… https://t.co/DR2xatDlRG",Mon Mar 12 17:28:07 +0000 2018,-0.3182,0.0,0.892,0.108,51
ABC News,"JUST IN: British Prime Minister Theresa May: ""It is highly likely that Russia was responsible"" for nerve agent atta… https://t.co/jB18JjmUoj",Mon Mar 12 17:25:14 +0000 2018,0.3182,0.108,0.892,0.0,52
ABC News,Campaign tactics by Democratic officials to ensure party retakes the House lead to growing concerns the heavy-hande… https://t.co/gqVtdqx2Lk,Mon Mar 12 17:15:35 +0000 2018,0.7184,0.318,0.682,0.0,53
ABC News,"""That was cool!"" Video shows  86-year-old bridge in Illinois being demolished. It took over 300 charges to complete… https://t.co/vqXyel6qyF",Mon Mar 12 16:52:32 +0000 2018,-0.3382,0.0,0.883,0.117,54
ABC News,"Houston Astros owner Jim Crane praises team for pulling together following Hurricane Harvey: ""59 years, we never wo… https://t.co/QmWWMkqn8l",Mon Mar 12 16:51:43 +0000 2018,0.5267,0.159,0.841,0.0,55
ABC News,"Pres. Trump calls Houston Astros' championship win after Hurricane Harvey devastated the region ""a befitting tribut… https://t.co/HKz7Vsx5To",Mon Mar 12 16:39:07 +0000 2018,0.4019,0.271,0.567,0.162,56
ABC News,LIVE: Pres. Trump welcomes World Series Champions Houston Astros at the White House. https://t.co/UrTaQbTQDe,Mon Mar 12 16:34:51 +0000 2018,0.7269,0.337,0.663,0.0,57
ABC News,"NEW: Lawyer for Stormy Daniels sends letter to Trump attorney Michael Cohen offering to return $130,000 to void non… https://t.co/gsv6cOcsRD",Mon Mar 12 16:31:25 +0000 2018,0.0,0.0,1.0,0.0,58
ABC News,Incredible drone footage captures the full force of Australia's iconic Barron Falls waterfall after record rainfall… https://t.co/VnE4yppGY4,Mon Mar 12 16:18:37 +0000 2018,0.0,0.0,1.0,0.0,59
ABC News,"NEW: Democrats urge Pres. Trump to ""devote all resources available"" to extradite 13 Russians charged with interferi… https://t.co/cMvzFhtNsT",Mon Mar 12 16:00:31 +0000 2018,0.1531,0.119,0.792,0.089,60
ABC News,U.S. submarines break through the ice as part of an exercise to expand operational readiness in the Arctic.… https://t.co/lIsEAnLjzU,Mon Mar 12 15:52:38 +0000 2018,0.5106,0.202,0.798,0.0,61
ABC News,LIVE: Meghan Markle joins royal family at Westminster Abbey for her first official event with the Queen.… https://t.co/85qBBs5IkA,Mon Mar 12 15:39:22 +0000 2018,0.0,0.0,1.0,0.0,62
ABC News,Gunman in California hostage incident that claimed the lives of three women was highly decorated Army veteran.… https://t.co/LuFaF14OZy,Mon Mar 12 15:33:51 +0000 2018,0.0,0.0,1.0,0.0,63
ABC News,"French couturier Hubert de Givenchy, a pioneer of ready-to-wear who designed Audrey Hepburn's black dress in ""Break… https://t.co/HUCJsL0mCp",Mon Mar 12 15:17:34 +0000 2018,0.0,0.0,1.0,0.0,64
ABC News,"Exposure to even very low levels of light at night has been linked to an increased risk of depression, according to… https://t.co/pp3MsAdfTT",Mon Mar 12 15:17:23 +0000 2018,-0.7264,0.074,0.636,0.29,65
ABC News,This kid's got rhythm! 2-year-old Matt's parents say he was just 18 months old when he started banging on everythin… https://t.co/bdnhv09coS,Mon Mar 12 14:50:03 +0000 2018,0.0,0.0,1.0,0.0,66
ABC News,"California animal shelter shares surveillance video of the 'candy crook' who, after a long struggle, managed to ste… https://t.co/8k7wsWNuFL",Mon Mar 12 14:32:04 +0000 2018,-0.0258,0.107,0.78,0.112,67
ABC News,"MORE: Helicopter crash in New York City's East River may have been caused by equipment from a passenger, the pilot… https://t.co/MJnDIrtYEZ",Mon Mar 12 14:08:41 +0000 2018,-0.5683,0.0,0.838,0.162,68
ABC News,"Southwest Airlines flight traveling from Phoenix to Dallas forced to make emergency landing because of smoke and ""a… https://t.co/87HWcO21YP",Mon Mar 12 14:04:07 +0000 2018,-0.6808,0.0,0.752,0.248,69
ABC News,UK Prime Minister Theresa May chairs a National Security Council meeting over the nerve agent attack on a former Ru… https://t.co/k0qilARYtZ,Mon Mar 12 13:59:06 +0000 2018,-0.1779,0.107,0.756,0.138,70
ABC News,"""Wow, what is that, man?"" Newly-released DoD video purportedly shows Navy pilot's encounter with UFO.… https://t.co/tHOk9z2tgI",Mon Mar 12 13:56:42 +0000 2018,0.0,0.0,1.0,0.0,71
ABC News,"DEVELOPING: Teenager killed, woman gravely injured in explosion in northeast section of Austin, Texas; FBI is assis… https://t.co/d3NtVnNsAJ",Mon Mar 12 13:39:30 +0000 2018,-0.8658,0.0,0.607,0.393,72
ABC News,Vladimir Putin says he approved of a plan to shoot down a hijacked  passenger jet he feared was targeting the Sochi… https://t.co/igYLt8dszN,Mon Mar 12 13:32:05 +0000 2018,-0.4215,0.11,0.669,0.22,73
ABC News,"NEW: In preliminary interview, pilot of helicopter that crashed in New York's East River Sunday night suggests a pa… https://t.co/2Werio1pwV",Mon Mar 12 13:26:50 +0000 2018,0.0,0.0,1.0,0.0,74
ABC News,"Firefighters in northern California are reunited with Boo, a dog they rescued and resuscitated from a devastating h… https://t.co/mGq6z5hY9n",Mon Mar 12 13:16:58 +0000 2018,-0.3612,0.127,0.679,0.195,75
ABC News,"Military parade ordered by Pres. Trump will take place on Veterans Day, according to memo for Chairman of the Joint… https://t.co/qsqH8znsQ7",Mon Mar 12 12:59:03 +0000 2018,0.0,0.0,1.0,0.0,76
ABC News,While the president has in recent weeks suggested other politicians have not pushed for changing the minimum age ou… https://t.co/j4BgIXnbs0,Mon Mar 12 12:57:04 +0000 2018,0.0,0.0,1.0,0.0,77
ABC News,Former Obama aide Ben Rhodes warns Pres. Trump can't approach the possible meeting with Kim Jong Un 'like a reality… https://t.co/VDDsGbptkB,Mon Mar 12 12:53:03 +0000 2018,0.2732,0.114,0.822,0.064,78
ABC News,"NEW: Advocacy group founded by Gabrielle Giffords: ""The policies that Trump has said he will support range from ins… https://t.co/qCiqxxtUVT",Mon Mar 12 12:50:04 +0000 2018,0.4019,0.124,0.876,0.0,79
ABC News,"Pres. Trump has called for bold action to improve school safety after last month's Parkland shooting, but a set of… https://t.co/oLP5uBjZcS",Mon Mar 12 12:45:06 +0000 2018,0.5647,0.249,0.751,0.0,80
ABC News,LATEST: NTSB sending 14-member crew to investigate helicopter crash in Manhattan's East River that killed five pass… https://t.co/Ff2UdBIPlO,Mon Mar 12 12:42:41 +0000 2018,-0.802,0.0,0.69,0.31,81
ABC News,"ANALYSIS: The math behind the Democrats' quest to win the Pennsylvania special election. 

Pres. Trump won this are… https://t.co/t2jf5rui2l",Mon Mar 12 12:30:05 +0000 2018,0.8807,0.389,0.611,0.0,82
ABC News,"GOP congressman: 'Nothing sinister' about recurring role in Russia probe.

“There is simply nothing sinister, and e… https://t.co/Xj3esysBLK",Mon Mar 12 12:26:54 +0000 2018,-0.8316,0.0,0.672,0.328,83
ABC News,"LATEST: At least 39 killed as passenger jet bursts into flames after landing at Kathmandu airport, Nepal. 

Of the… https://t.co/0TBbEcxn5Q",Mon Mar 12 12:23:04 +0000 2018,-0.6705,0.0,0.809,0.191,84
ABC News,Three USPS employees treated after coming in contact with a package containing unknown hazardous substance at mail-… https://t.co/5ANHYNQYt7,Mon Mar 12 12:05:07 +0000 2018,0.0,0.0,1.0,0.0,85
ABC News,Chaotic crowd video shows the moment PETA animal rights activists stormed a Crufts dog show prize ceremony in Birmi… https://t.co/5Lk8Qk8I2A,Mon Mar 12 11:57:23 +0000 2018,0.0258,0.14,0.723,0.136,86
ABC News,"RT @GMA: White House unveils new gun safety plan, as students around the country plan  a walk-out. @TomLlamasABC has the story https://t.co…",Mon Mar 12 11:54:01 +0000 2018,0.1027,0.116,0.785,0.099,87
ABC News,Arizona border officer falsely claimed he was born in the US to illegally obtain a job with US Customs and Border P… https://t.co/KDJ448Pv2w,Mon Mar 12 11:44:35 +0000 2018,0.0,0.0,1.0,0.0,88
ABC News,"Pres. Trump launched his planned 2020 election campaign slogan at a weekend rally in Pennsylvania: ""Keep America Gr… https://t.co/BeOXeiKPQm",Mon Mar 12 11:28:28 +0000 2018,0.128,0.081,0.919,0.0,89
ABC News,"RT @GMA: A helicopter crash in Manhattan's East River kills all 5 passengers, but the pilot was able to escape. @GioBenitez has the story:…",Mon Mar 12 11:11:54 +0000 2018,-0.2617,0.082,0.755,0.163,90
ABC News,"All 5 passengers died after a helicopter crashed into Manhattan's East River Sunday evening.

The pilot ""freed hims… https://t.co/ziZgzJ7NMU",Mon Mar 12 11:11:20 +0000 2018,-0.2263,0.127,0.704,0.169,91
ABC News,"In a tight House race, Republican Rick Saccone leans on Trump and his base. 

He needs the residents of Pennsylvani… https://t.co/6ZPSXcl676",Mon Mar 12 11:07:05 +0000 2018,0.0,0.0,1.0,0.0,92
ABC News,"At least 38 people have been killed, 23 injured and 10 people are unaccounted for after a passenger plane attemptin… https://t.co/eyX5cE3D4y",Mon Mar 12 11:07:02 +0000 2018,-0.802,0.0,0.714,0.286,93
ABC News,"Defense Sec. James Mattis says that diplomacy with North Korea is at a delicate stage: ""I do not want to talk about… https://t.co/XJV43jdExG",Mon Mar 12 10:51:34 +0000 2018,0.1225,0.118,0.829,0.053,94
ABC News,Cellphone video captures chaotic scene after suspected hit-and-run crash in South Florida. Police say no one was in… https://t.co/0uec6gylem,Mon Mar 12 10:47:31 +0000 2018,-0.8402,0.0,0.6,0.4,95
ABC News,LATEST: More detail has emerged about the five passengers killed in last night's Manhattan helicopter crash. Four w… https://t.co/vch9CRZZqY,Mon Mar 12 10:47:29 +0000 2018,-0.802,0.0,0.702,0.298,96
ABC News,"Passenger jet attempting to land at Kathmandu International Airport in Nepal skidded off a runway, crashed and burs… https://t.co/B5UEsx1YVk",Mon Mar 12 10:37:57 +0000 2018,0.0,0.0,1.0,0.0,97
ABC News,The tallest building in Kentucky's capital city came crashing down in a controlled implosion over the weekend.… https://t.co/Sy9glgRjj9,Mon Mar 12 10:30:10 +0000 2018,0.0,0.0,1.0,0.0,98
ABC News,Video shows firefighters at the site of a plane crash at Kathmandu airport in Nepal as the rescue operation continu… https://t.co/BIr2OHfBk5,Mon Mar 12 10:19:33 +0000 2018,0.1531,0.137,0.75,0.113,99
ABC News,Clouds of smoke are seen rising from the scene of a passenger plane crash at Kathmandu airport in Nepal. The plane… https://t.co/RokTvef0yR,Mon Mar 12 10:01:38 +0000 2018,-0.4019,0.0,0.881,0.119,100
ABC News,'Explosive sounds' are heard during the eruption of Mount Shinmoedake that lit up the night sky in Japan. The volca… https://t.co/SQwbOI4hay,Mon Mar 12 09:54:53 +0000 2018,0.0,0.0,1.0,0.0,101
ABC News,"DEVELOPING: Passenger plane crashes while landing at Kathmandu airport, airport official says. It is unclear whethe… https://t.co/BItoPKJO67",Mon Mar 12 09:35:05 +0000 2018,-0.25,0.0,0.889,0.111,102
ABC News,Five people have died after a helicopter crashed into the East River in New York City. Only the pilot survived the… https://t.co/PT6BXdYWsi,Mon Mar 12 09:29:03 +0000 2018,-0.0772,0.127,0.734,0.139,103
ABC News,Authorities recover the black box from a Turkish private jet that crashed in Iran while traveling from the United A… https://t.co/SyksBO79ng,Mon Mar 12 09:11:57 +0000 2018,0.4215,0.128,0.872,0.0,104
ABC News,The pilot in the Manhattan helicopter crash that killed all five passengers has been treated and released from hosp… https://t.co/pSXyTI2qcd,Mon Mar 12 09:04:42 +0000 2018,-0.802,0.0,0.714,0.286,105
ABC News,"Country music star Tim McGraw collapsed on stage during a show in Ireland on Sunday.

""He was attended to by local… https://t.co/tzP2vED4ao",Mon Mar 12 08:49:29 +0000 2018,-0.2732,0.0,0.905,0.095,106
ABC News,"White House deputy press secretary says Pres. Trump still ""intends to"" meet with special counsel Robert Mueller und… https://t.co/IdQfXADlx0",Mon Mar 12 08:31:03 +0000 2018,0.4019,0.13,0.87,0.0,107
ABC News,"The Trump administration is promising consumers a digital-age health care approach, with officials promising consum… https://t.co/bYkpfDF8gj",Mon Mar 12 07:55:45 +0000 2018,0.8225,0.417,0.583,0.0,108
ABC News,"Students, teachers, parents and administrators across the country are invited to take part in a National School Wal… https://t.co/26QSzqgSJh",Mon Mar 12 07:31:07 +0000 2018,0.0,0.0,1.0,0.0,109
ABC News,"Mattis says the Trump administration has made it clear to the Syrian government that it would be ""very unwise"" to u… https://t.co/BQupskP8ZD",Mon Mar 12 06:57:16 +0000 2018,0.3818,0.11,0.89,0.0,110
ABC News,The more the merrier! These playful gray whales let a humpback whale join their frolicking in the waters off the Mo… https://t.co/Z1KKwlbvLP,Mon Mar 12 06:31:43 +0000 2018,0.8111,0.317,0.683,0.0,111
ABC News,"White House: North Korea has to make good on ""promises"" before meeting with Pres. Trump. https://t.co/fvPATsFbpt https://t.co/3Hlg9Qn8mb",Mon Mar 12 06:05:04 +0000 2018,0.4404,0.153,0.847,0.0,112
ABC News,Three USPS employees treated after coming in contact with a package containing unknown hazardous substance at mail-… https://t.co/YUkohhtNcE,Mon Mar 12 05:43:29 +0000 2018,0.0,0.0,1.0,0.0,113
ABC News,"BREAKING: All five passengers on board helicopter that crashed into NYC's East River have died, FDNY official confi… https://t.co/pXsKPfC2TY",Mon Mar 12 05:31:42 +0000 2018,-0.5574,0.0,0.833,0.167,114
ABC News,Cellphone video captures chaotic scene after suspected hit-and-run crash in South Florida. https://t.co/6ToR6GE9dS… https://t.co/2ySTCbyFKp,Mon Mar 12 05:17:18 +0000 2018,-0.7783,0.0,0.585,0.415,115
ABC News,While the president has in recent weeks suggested other politicians have not pushed for changing the minimum age ou… https://t.co/dwWD4SZHgY,Mon Mar 12 05:01:54 +0000 2018,0.0,0.0,1.0,0.0,116
ABC News,A San Francisco fertility clinic suffered a rare cryostorage malfunction on the same day as a hospital in Cleveland… https://t.co/DoYqPQYGFy,Mon Mar 12 04:40:05 +0000 2018,-0.4939,0.0,0.833,0.167,117
ABC News,"Actor Wendell Pierce, who played a Baltimore police detective on 'The Wire,' says the apartment complex he's develo… https://t.co/6GranOiljm",Mon Mar 12 04:13:29 +0000 2018,0.34,0.124,0.876,0.0,118
ABC News,Dramatic hoist cam footage shows California Highway Patrol Air Operations officers rescuing an injured hiker strand… https://t.co/LoumR1Ctoh,Mon Mar 12 04:09:00 +0000 2018,-0.4019,0.0,0.856,0.144,119
ABC News,Reports of 'explosive sounds' were heard during the eruption of Mount Shinmoedake that lit up the night sky in Japa… https://t.co/SlrRZDvYtN,Mon Mar 12 03:57:26 +0000 2018,0.0,0.0,1.0,0.0,120
ABC News,Former Confederate site at Baltimore park rededicated to abolitionist Harriet Tubman. https://t.co/cHRwE0TuSx https://t.co/bUjWe9eTJg,Mon Mar 12 03:41:05 +0000 2018,0.0,0.0,1.0,0.0,121
ABC News,US Steel bringing back 500 jobs in Illinois after President Trump's tariff announcement. https://t.co/HW4o8D46ZB https://t.co/VDyr2nfIz2,Mon Mar 12 03:24:06 +0000 2018,0.0,0.0,1.0,0.0,122
ABC News,Elizabeth Warren says she has no intention of running for president in 2020 - but the Massachusetts senator has ref… https://t.co/ZgIgCE9Piy,Mon Mar 12 03:07:15 +0000 2018,-0.1531,0.0,0.922,0.078,123
ABC News,"RT @ABCWorldNews: NEW FERTILITY CLINIC FAILURE: For the second time in less than a week, a critical malfunction has struck a fertility clin…",Mon Mar 12 03:03:24 +0000 2018,-0.7946,0.0,0.678,0.322,124
ABC News,Arizona border officer falsely claimed he was born in U.S. to illegally obtain a job with U.S. Customs and Border P… https://t.co/uPP1SEprlC,Mon Mar 12 02:42:23 +0000 2018,0.0,0.0,1.0,0.0,125
